{
	"$schema": "https://raw.githubusercontent.com/earendil-works/pi/main/packages/coding-agent/src/modes/interactive/theme/theme-schema.json",
	"name": "light",
	"vars": {
		"teal": "#3f7378",
		"blue": "#416f9f",
		"green": "#357a43",
		"red": "#b14357",
		"yellow": "#8a6118",
		"text": "#202733",
		"mediumGray": "#5f6878",
		"dimGray": "#737c8c",
		"lightGray": "#b6bfcc",
		"selectedBg": "#e8eef8",
		"userMsgBg": "#eef2f7",
		"toolPendingBg": "#e3ebf7",
		"toolSuccessBg": "#e6f3e8",
		"toolErrorBg": "#f8e6ea",
		"customMsgBg": "#f7f8fb"
	},
	"colors": {
		"accent": "teal",
		"border": "blue",
		"borderAccent": "teal",
		"borderMuted": "lightGray",
		"success": "green",
		"error": "red",
		"warning": "yellow",
		"muted": "mediumGray",
		"dim": "dimGray",
		"text": "text",
		"thinkingText": "mediumGray",

		"selectedBg": "selectedBg",
		"userMessageBg": "userMsgBg",
		"userMessageText": "text",
		"customMessageBg": "customMsgBg",
		"customMessageText": "text",
		"customMessageLabel": "#6f4bb8",
		"toolPendingBg": "toolPendingBg",
		"toolSuccessBg": "toolSuccessBg",
		"toolErrorBg": "toolErrorBg",
		"toolTitle": "text",
		"toolOutput": "mediumGray",

		"mdHeading": "yellow",
		"mdLink": "blue",
		"mdLinkUrl": "dimGray",
		"mdCode": "teal",
		"mdCodeBlock": "text",
		"mdCodeBlockBorder": "lightGray",
		"mdQuote": "mediumGray",
		"mdQuoteBorder": "#6f4bb8",
		"mdHr": "lightGray",
		"mdListBullet": "green",

		"toolDiffAdded": "green",
		"toolDiffRemoved": "red",
		"toolDiffContext": "mediumGray",

		"syntaxComment": "#4f7a55",
		"syntaxKeyword": "#315f9a",
		"syntaxFunction": "#7a561b",
		"syntaxVariable": "#244d82",
		"syntaxString": "#963f3f",
		"syntaxNumber": "#2c7758",
		"syntaxType": "#2f7180",
		"syntaxOperator": "text",
		"syntaxPunctuation": "text",

		"thinkingOff": "lightGray",
		"thinkingMinimal": "dimGray",
		"thinkingLow": "blue",
		"thinkingMedium": "teal",
		"thinkingHigh": "#74518b",
		"thinkingXhigh": "#7b397f",
		"thinkingMax": "#9f315f",

		"bashMode": "green"
	},
	"export": {
		"pageBg": "#eef1f6",
		"cardBg": "#f7f8fb",
		"infoBg": "#e3ebf7"
	}
}
