{
	"$schema": "https://raw.githubusercontent.com/earendil-works/pi/main/packages/coding-agent/src/modes/interactive/theme/theme-schema.json",
	"name": "Everforest",
	"vars": {
		"page": "#1e2326",
		"terminal": "#2d353b",
		"surface1": "#343f44",
		"surface2": "#232a2e",
		"surface3": "#3d484d",
		"text": "#d3c6aa",
		"strong": "#e8dfc7",
		"muted": "#9da9a0",
		"dim": "#7a8478",
		"red": "#e67e80",
		"orange": "#e69875",
		"yellow": "#dbbc7f",
		"green": "#a7c080",
		"aqua": "#83c092",
		"blue": "#7fbbb3",
		"purple": "#d699b6",
		"border": "#56635f",
		"borderSoft": "#475258",
		"userBg": "#3a464c",
		"pendingBg": "#3a515d",
		"successBg": "#3c4841",
		"errorBg": "#514045"
	},
	"colors": {
		"accent": "blue",
		"border": "border",
		"borderAccent": "aqua",
		"borderMuted": "borderSoft",
		"success": "green",
		"error": "red",
		"warning": "yellow",
		"muted": "muted",
		"dim": "dim",
		"text": "text",
		"thinkingText": "muted",
		"selectedBg": "surface3",
		"userMessageBg": "userBg",
		"userMessageText": "strong",
		"customMessageBg": "surface1",
		"customMessageText": "text",
		"customMessageLabel": "purple",
		"toolPendingBg": "pendingBg",
		"toolSuccessBg": "successBg",
		"toolErrorBg": "errorBg",
		"toolTitle": "strong",
		"toolOutput": "muted",
		"mdHeading": "yellow",
		"mdLink": "blue",
		"mdLinkUrl": "dim",
		"mdCode": "aqua",
		"mdCodeBlock": "text",
		"mdCodeBlockBorder": "borderSoft",
		"mdQuote": "muted",
		"mdQuoteBorder": "purple",
		"mdHr": "borderSoft",
		"mdListBullet": "green",
		"toolDiffAdded": "green",
		"toolDiffRemoved": "red",
		"toolDiffContext": "muted",
		"syntaxComment": "dim",
		"syntaxKeyword": "red",
		"syntaxFunction": "green",
		"syntaxVariable": "text",
		"syntaxString": "aqua",
		"syntaxNumber": "purple",
		"syntaxType": "yellow",
		"syntaxOperator": "orange",
		"syntaxPunctuation": "muted",
		"thinkingOff": "dim",
		"thinkingMinimal": "muted",
		"thinkingLow": "blue",
		"thinkingMedium": "purple",
		"thinkingHigh": "aqua",
		"thinkingXhigh": "yellow",
		"thinkingMax": "red",
		"bashMode": "green"
	},
	"export": {
		"pageBg": "page",
		"cardBg": "surface1",
		"infoBg": "pendingBg"
	}
}
