{
	"$schema": "https://raw.githubusercontent.com/earendil-works/pi/main/packages/coding-agent/src/modes/interactive/theme/theme-schema.json",
	"name": "tokyonight",
	"vars": {
		"page": "#0f0f17",
		"terminal": "#16161e",
		"surface1": "#1a1b26",
		"surface2": "#13141c",
		"surface3": "#24283b",
		"toolHead": "#1f3346",
		"toolBody": "#1b2a3a",
		"text": "#c0caf5",
		"strong": "#e6e9ff",
		"muted": "#9aa5ce",
		"dim": "#737aa2",
		"blue": "#7aa2f7",
		"blue2": "#7dcfff",
		"purple": "#bb9af7",
		"cyan": "#7dcfff",
		"green": "#9ece6a",
		"yellow": "#e0af68",
		"red": "#f7768e",
		"border": "#53658c",
		"borderSoft": "#2f3549",
		"userBg": "#1f2335",
		"addBg": "#233329",
		"removeBg": "#38242e",
		"addText": "#b9e58c",
		"removeText": "#ff9aae"
	},
	"colors": {
		"accent": "blue",
		"border": "border",
		"borderAccent": "cyan",
		"borderMuted": "borderSoft",
		"success": "green",
		"error": "red",
		"warning": "yellow",
		"muted": "muted",
		"dim": "dim",
		"text": "text",
		"thinkingText": "muted",
		"selectedBg": "surface3",
		"userMessageBg": "userBg",
		"userMessageText": "strong",
		"customMessageBg": "terminal",
		"customMessageText": "text",
		"customMessageLabel": "purple",
		"toolPendingBg": "toolBody",
		"toolSuccessBg": "addBg",
		"toolErrorBg": "removeBg",
		"toolTitle": "strong",
		"toolOutput": "text",
		"mdHeading": "blue",
		"mdLink": "blue2",
		"mdLinkUrl": "dim",
		"mdCode": "cyan",
		"mdCodeBlock": "text",
		"mdCodeBlockBorder": "borderSoft",
		"mdQuote": "muted",
		"mdQuoteBorder": "purple",
		"mdHr": "borderSoft",
		"mdListBullet": "blue",
		"toolDiffAdded": "addText",
		"toolDiffRemoved": "removeText",
		"toolDiffContext": "muted",
		"syntaxComment": "dim",
		"syntaxKeyword": "purple",
		"syntaxFunction": "blue2",
		"syntaxVariable": "text",
		"syntaxString": "green",
		"syntaxNumber": "yellow",
		"syntaxType": "cyan",
		"syntaxOperator": "blue",
		"syntaxPunctuation": "muted",
		"thinkingOff": "dim",
		"thinkingMinimal": "muted",
		"thinkingLow": "blue",
		"thinkingMedium": "purple",
		"thinkingHigh": "cyan",
		"thinkingXhigh": "yellow",
		"thinkingMax": "red",
		"bashMode": "green"
	},
	"export": {
		"pageBg": "page",
		"cardBg": "terminal",
		"infoBg": "toolBody"
	}
}
