{
	"$schema": "https://raw.githubusercontent.com/earendil-works/pi/main/packages/coding-agent/src/modes/interactive/theme/theme-schema.json",
	"name": "dark",
	"vars": {
		"cyan": "#67d5e8",
		"blue": "#7aa2f7",
		"green": "#9bdc7a",
		"red": "#ff758f",
		"yellow": "#e0af68",
		"text": "#dce3f2",
		"gray": "#929bb1",
		"dimGray": "#727b91",
		"darkGray": "#3e475a",
		"accent": "#7dcfff",
		"selectedBg": "#20283a",
		"userMsgBg": "#1e2534",
		"toolPendingBg": "#1d2d3f",
		"toolSuccessBg": "#203329",
		"toolErrorBg": "#38252d",
		"customMsgBg": "#171b26"
	},
	"colors": {
		"accent": "accent",
		"border": "blue",
		"borderAccent": "cyan",
		"borderMuted": "darkGray",
		"success": "green",
		"error": "red",
		"warning": "yellow",
		"muted": "gray",
		"dim": "dimGray",
		"text": "text",
		"thinkingText": "gray",

		"selectedBg": "selectedBg",
		"userMessageBg": "userMsgBg",
		"userMessageText": "text",
		"customMessageBg": "customMsgBg",
		"customMessageText": "text",
		"customMessageLabel": "#b89cff",
		"toolPendingBg": "toolPendingBg",
		"toolSuccessBg": "toolSuccessBg",
		"toolErrorBg": "toolErrorBg",
		"toolTitle": "text",
		"toolOutput": "gray",

		"mdHeading": "yellow",
		"mdLink": "blue",
		"mdLinkUrl": "dimGray",
		"mdCode": "accent",
		"mdCodeBlock": "text",
		"mdCodeBlockBorder": "darkGray",
		"mdQuote": "gray",
		"mdQuoteBorder": "#b89cff",
		"mdHr": "darkGray",
		"mdListBullet": "accent",

		"toolDiffAdded": "green",
		"toolDiffRemoved": "red",
		"toolDiffContext": "gray",

		"syntaxComment": "#6f8f72",
		"syntaxKeyword": "#7aa2f7",
		"syntaxFunction": "#e0af68",
		"syntaxVariable": "#b7d5ff",
		"syntaxString": "#a8d88d",
		"syntaxNumber": "#d6c596",
		"syntaxType": "#67d5e8",
		"syntaxOperator": "text",
		"syntaxPunctuation": "text",

		"thinkingOff": "darkGray",
		"thinkingMinimal": "dimGray",
		"thinkingLow": "blue",
		"thinkingMedium": "#b89cff",
		"thinkingHigh": "cyan",
		"thinkingXhigh": "yellow",
		"thinkingMax": "red",

		"bashMode": "green"
	},
	"export": {
		"pageBg": "#10131b",
		"cardBg": "#171b26",
		"infoBg": "#1d2d3f"
	}
}
