{
	"$schema": "https://raw.githubusercontent.com/earendil-works/pi/main/packages/coding-agent/src/modes/interactive/theme/theme-schema.json",
	"name": "GitHub Dark",
	"vars": {
		"page": "#010409",
		"terminal": "#0d1117",
		"surface1": "#161b22",
		"surface2": "#1c2128",
		"surface3": "#21262d",
		"text": "#c9d1d9",
		"strong": "#f0f6fc",
		"muted": "#8b949e",
		"dim": "#6e7681",
		"blue": "#58a6ff",
		"blue2": "#79c0ff",
		"purple": "#bc8cff",
		"cyan": "#56d4dd",
		"green": "#3fb950",
		"yellow": "#d29922",
		"red": "#f85149",
		"border": "#30363d",
		"borderSoft": "#21262d",
		"userBg": "#1c2128",
		"pendingBg": "#1b2733",
		"successBg": "#173323",
		"errorBg": "#3b1e24",
		"addText": "#56d364",
		"removeText": "#ff7b72"
	},
	"colors": {
		"accent": "blue",
		"border": "border",
		"borderAccent": "blue2",
		"borderMuted": "borderSoft",
		"success": "green",
		"error": "red",
		"warning": "yellow",
		"muted": "muted",
		"dim": "dim",
		"text": "text",
		"thinkingText": "muted",
		"selectedBg": "surface3",
		"userMessageBg": "userBg",
		"userMessageText": "strong",
		"customMessageBg": "surface1",
		"customMessageText": "text",
		"customMessageLabel": "purple",
		"toolPendingBg": "pendingBg",
		"toolSuccessBg": "successBg",
		"toolErrorBg": "errorBg",
		"toolTitle": "strong",
		"toolOutput": "muted",
		"mdHeading": "blue2",
		"mdLink": "blue",
		"mdLinkUrl": "dim",
		"mdCode": "cyan",
		"mdCodeBlock": "text",
		"mdCodeBlockBorder": "borderSoft",
		"mdQuote": "muted",
		"mdQuoteBorder": "purple",
		"mdHr": "borderSoft",
		"mdListBullet": "blue",
		"toolDiffAdded": "addText",
		"toolDiffRemoved": "removeText",
		"toolDiffContext": "muted",
		"syntaxComment": "dim",
		"syntaxKeyword": "purple",
		"syntaxFunction": "blue2",
		"syntaxVariable": "text",
		"syntaxString": "green",
		"syntaxNumber": "yellow",
		"syntaxType": "cyan",
		"syntaxOperator": "text",
		"syntaxPunctuation": "muted",
		"thinkingOff": "dim",
		"thinkingMinimal": "muted",
		"thinkingLow": "blue",
		"thinkingMedium": "purple",
		"thinkingHigh": "cyan",
		"thinkingXhigh": "yellow",
		"thinkingMax": "red",
		"bashMode": "green"
	},
	"export": {
		"pageBg": "page",
		"cardBg": "surface1",
		"infoBg": "pendingBg"
	}
}
