{
	"$schema": "https://raw.githubusercontent.com/earendil-works/pi/main/packages/coding-agent/src/modes/interactive/theme/theme-schema.json",
	"name": "AFO Midnight",
	"vars": {
		"page": "#080b12",
		"terminal": "#171c29",
		"surface1": "#141925",
		"surface2": "#111622",
		"surface3": "#20273a",
		"toolHead": "#1d3344",
		"toolBody": "#182a38",
		"text": "#b7c2e3",
		"strong": "#e4e9ff",
		"muted": "#7f8bb3",
		"dim": "#58627f",
		"blue": "#6fa8ff",
		"blue2": "#8fc3ff",
		"purple": "#b89cff",
		"cyan": "#67d5e8",
		"green": "#9bdc7a",
		"yellow": "#f0c75e",
		"red": "#ff758f",
		"border": "#557ebf",
		"borderSoft": "#273550",
		"userBg": "#1e2536",
		"addBg": "#263132",
		"removeBg": "#2e2533",
		"addText": "#b8ec99",
		"removeText": "#ff9caf"
	},
	"colors": {
		"accent": "blue",
		"border": "border",
		"borderAccent": "cyan",
		"borderMuted": "borderSoft",
		"success": "green",
		"error": "red",
		"warning": "yellow",
		"muted": "muted",
		"dim": "dim",
		"text": "text",
		"thinkingText": "muted",
		"selectedBg": "surface3",
		"userMessageBg": "userBg",
		"userMessageText": "strong",
		"customMessageBg": "surface1",
		"customMessageText": "text",
		"customMessageLabel": "purple",
		"toolPendingBg": "toolBody",
		"toolSuccessBg": "addBg",
		"toolErrorBg": "removeBg",
		"toolTitle": "strong",
		"toolOutput": "text",
		"mdHeading": "blue",
		"mdLink": "blue2",
		"mdLinkUrl": "dim",
		"mdCode": "cyan",
		"mdCodeBlock": "text",
		"mdCodeBlockBorder": "borderSoft",
		"mdQuote": "muted",
		"mdQuoteBorder": "purple",
		"mdHr": "borderSoft",
		"mdListBullet": "blue",
		"toolDiffAdded": "addText",
		"toolDiffRemoved": "removeText",
		"toolDiffContext": "muted",
		"syntaxComment": "dim",
		"syntaxKeyword": "purple",
		"syntaxFunction": "blue2",
		"syntaxVariable": "text",
		"syntaxString": "green",
		"syntaxNumber": "yellow",
		"syntaxType": "cyan",
		"syntaxOperator": "blue",
		"syntaxPunctuation": "muted",
		"thinkingOff": "dim",
		"thinkingMinimal": "muted",
		"thinkingLow": "blue",
		"thinkingMedium": "purple",
		"thinkingHigh": "cyan",
		"thinkingXhigh": "yellow",
		"thinkingMax": "red",
		"bashMode": "green"
	},
	"export": {
		"pageBg": "page",
		"cardBg": "terminal",
		"infoBg": "toolBody"
	}
}
