{
	"$schema": "https://raw.githubusercontent.com/earendil-works/pi/main/packages/coding-agent/src/modes/interactive/theme/theme-schema.json",
	"name": "Catppuccin Mocha",
	"vars": {
		"page": "#0d0d16",
		"terminal": "#1e1e2e",
		"surface1": "#181825",
		"surface2": "#11111b",
		"surface3": "#313244",
		"toolHead": "#26344a",
		"toolBody": "#223047",
		"text": "#cdd6f4",
		"strong": "#f5e0dc",
		"muted": "#9399b2",
		"dim": "#6c7086",
		"blue": "#89b4fa",
		"blue2": "#74c7ec",
		"purple": "#cba6f7",
		"cyan": "#89dceb",
		"green": "#a6e3a1",
		"yellow": "#f9e2af",
		"red": "#f38ba8",
		"border": "#6987bd",
		"borderSoft": "#313953",
		"userBg": "#2d2e3f",
		"addBg": "#2d343b",
		"removeBg": "#33293a",
		"addText": "#b9efb4",
		"removeText": "#ffadc1"
	},
	"colors": {
		"accent": "blue",
		"border": "border",
		"borderAccent": "cyan",
		"borderMuted": "borderSoft",
		"success": "green",
		"error": "red",
		"warning": "yellow",
		"muted": "muted",
		"dim": "dim",
		"text": "text",
		"thinkingText": "muted",
		"selectedBg": "surface3",
		"userMessageBg": "userBg",
		"userMessageText": "strong",
		"customMessageBg": "surface1",
		"customMessageText": "text",
		"customMessageLabel": "purple",
		"toolPendingBg": "toolBody",
		"toolSuccessBg": "addBg",
		"toolErrorBg": "removeBg",
		"toolTitle": "strong",
		"toolOutput": "text",
		"mdHeading": "blue",
		"mdLink": "blue2",
		"mdLinkUrl": "dim",
		"mdCode": "cyan",
		"mdCodeBlock": "text",
		"mdCodeBlockBorder": "borderSoft",
		"mdQuote": "muted",
		"mdQuoteBorder": "purple",
		"mdHr": "borderSoft",
		"mdListBullet": "blue",
		"toolDiffAdded": "addText",
		"toolDiffRemoved": "removeText",
		"toolDiffContext": "muted",
		"syntaxComment": "dim",
		"syntaxKeyword": "purple",
		"syntaxFunction": "blue",
		"syntaxVariable": "text",
		"syntaxString": "green",
		"syntaxNumber": "yellow",
		"syntaxType": "cyan",
		"syntaxOperator": "blue2",
		"syntaxPunctuation": "muted",
		"thinkingOff": "dim",
		"thinkingMinimal": "muted",
		"thinkingLow": "blue2",
		"thinkingMedium": "purple",
		"thinkingHigh": "cyan",
		"thinkingXhigh": "yellow",
		"thinkingMax": "red",
		"bashMode": "green"
	},
	"export": {
		"pageBg": "page",
		"cardBg": "terminal",
		"infoBg": "toolBody"
	}
}
